[
 {
  "record_id": "lu_0_1",
  "site_id": "lwas",
  "source_message_id": "msg_0_420",
  "sent_at": "2026-09-10T07:00:00+07:00",
  "sender_raw": "Amartha",
  "sender_person_id": null,
  "confidence": 0.9,
  "shift": 1,
  "date": "2026-09-10",
  "entries": [
   {
    "area_id": "external",
    "name_raw": "Ade",
    "person_id": "ade"
   },
   {
    "area_id": "external",
    "name_raw": "Renno",
    "person_id": "renno"
   },
   {
    "area_id": "external",
    "name_raw": "Nando",
    "person_id": "nando"
   },
   {
    "area_id": "external",
    "name_raw": "Sandi",
    "person_id": "sandi"
   },
   {
    "area_id": "external",
    "name_raw": "Okta",
    "person_id": "okta"
   },
   {
    "area_id": "external",
    "name_raw": "Marhadi",
    "person_id": "marhadi"
   },
   {
    "area_id": "gf",
    "name_raw": "Ani",
    "person_id": "ani"
   },
   {
    "area_id": "gf",
    "name_raw": "Deviana",
    "person_id": "deviana"
   },
   {
    "area_id": "gf",
    "name_raw": "Tiara",
    "person_id": "tiara"
   },
   {
    "area_id": "gf",
    "name_raw": "Junaesi",
    "person_id": "junaesi"
   },
   {
    "area_id": "gf",
    "name_raw": "Febby",
    "person_id": "febby"
   },
   {
    "area_id": "gf",
    "name_raw": "Muhamad hafiz",
    "person_id": "muhamad_hafiz"
   },
   {
    "area_id": "gf",
    "name_raw": "Warti",
    "person_id": "warti"
   },
   {
    "area_id": "gf",
    "name_raw": "Septian",
    "person_id": "septian"
   },
   {
    "area_id": "ug",
    "name_raw": "Mardiah",
    "person_id": "mardiah"
   },
   {
    "area_id": "ug",
    "name_raw": "Damme",
    "person_id": "damme"
   },
   {
    "area_id": "ug",
    "name_raw": "Farhan",
    "person_id": "farhan"
   },
   {
    "area_id": "ug",
    "name_raw": "Sahroni",
    "person_id": "sahroni"
   },
   {
    "area_id": "ug",
    "name_raw": "Nurul",
    "person_id": "nurul"
   },
   {
    "area_id": "lt2",
    "name_raw": "Aryo",
    "person_id": "aryo"
   },
   {
    "area_id": "lt2",
    "name_raw": "Naisah",
    "person_id": "naisah"
   },
   {
    "area_id": "lt2",
    "name_raw": "Iska",
    "person_id": "iska"
   },
   {
    "area_id": "lt2",
    "name_raw": "Inez",
    "person_id": "inez"
   },
   {
    "area_id": "lt2",
    "name_raw": "Dikri",
    "person_id": "dikri"
   },
   {
    "area_id": "lt2",
    "name_raw": "Hera",
    "person_id": "hera"
   },
   {
    "area_id": "lt1",
    "name_raw": "Deviyanti",
    "person_id": "deviyanti"
   },
   {
    "area_id": "lt1",
    "name_raw": "Heri",
    "person_id": "heri"
   },
   {
    "area_id": "lt1",
    "name_raw": "Rangga",
    "person_id": "rangga"
   },
   {
    "area_id": "lt1",
    "name_raw": "Nenti",
    "person_id": "nenti"
   },
   {
    "area_id": "lt1",
    "name_raw": "Mariam",
    "person_id": "mariam"
   },
   {
    "area_id": "lk",
    "name_raw": "Hermawati",
    "person_id": "hermawati"
   },
   {
    "area_id": "lk",
    "name_raw": "Agus",
    "person_id": "agus"
   },
   {
    "area_id": "lk",
    "name_raw": "Revaldi",
    "person_id": "revaldi"
   },
   {
    "area_id": "garbage",
    "name_raw": "muhamad Abdullah",
    "person_id": "muhamad_abdullah"
   },
   {
    "area_id": "gondola",
    "name_raw": "afif",
    "person_id": "afif"
   },
   {
    "area_id": "gondola",
    "name_raw": "riyan",
    "person_id": "riyan"
   },
   {
    "area_id": "gondola",
    "name_raw": "Sahrul",
    "person_id": "sahrul"
   }
  ],
  "total_mp": 37,
  "off_day": 0,
  "sakit": 0,
  "alfa": 0,
  "izin": 0
 },
 {
  "record_id": "lu_0_2",
  "site_id": "lwas",
  "source_message_id": "msg_0_900",
  "sent_at": "2026-09-10T15:00:00+07:00",
  "sender_raw": "Amartha",
  "sender_person_id": null,
  "confidence": 0.9,
  "shift": 2,
  "date": "2026-09-10",
  "entries": [
   {
    "area_id": "external",
    "name_raw": "Ade",
    "person_id": "ade"
   },
   {
    "area_id": "external",
    "name_raw": "Renno",
    "person_id": "renno"
   },
   {
    "area_id": "external",
    "name_raw": "Nando",
    "person_id": "nando"
   },
   {
    "area_id": "external",
    "name_raw": "Sandi",
    "person_id": "sandi"
   },
   {
    "area_id": "external",
    "name_raw": "Okta",
    "person_id": "okta"
   },
   {
    "area_id": "external",
    "name_raw": "Marhadi",
    "person_id": "marhadi"
   },
   {
    "area_id": "gf",
    "name_raw": "Ani",
    "person_id": "ani"
   },
   {
    "area_id": "gf",
    "name_raw": "Deviana",
    "person_id": "deviana"
   },
   {
    "area_id": "gf",
    "name_raw": "Tiara",
    "person_id": "tiara"
   },
   {
    "area_id": "gf",
    "name_raw": "Junaesi",
    "person_id": "junaesi"
   },
   {
    "area_id": "gf",
    "name_raw": "Febby",
    "person_id": "febby"
   },
   {
    "area_id": "gf",
    "name_raw": "Muhamad hafiz",
    "person_id": "muhamad_hafiz"
   },
   {
    "area_id": "gf",
    "name_raw": "Warti",
    "person_id": "warti"
   },
   {
    "area_id": "gf",
    "name_raw": "Septian",
    "person_id": "septian"
   },
   {
    "area_id": "ug",
    "name_raw": "Mardiah",
    "person_id": "mardiah"
   },
   {
    "area_id": "ug",
    "name_raw": "Damme",
    "person_id": "damme"
   },
   {
    "area_id": "ug",
    "name_raw": "Farhan",
    "person_id": "farhan"
   },
   {
    "area_id": "ug",
    "name_raw": "Sahroni",
    "person_id": "sahroni"
   },
   {
    "area_id": "ug",
    "name_raw": "Nurul",
    "person_id": "nurul"
   },
   {
    "area_id": "lt2",
    "name_raw": "Aryo",
    "person_id": "aryo"
   },
   {
    "area_id": "lt2",
    "name_raw": "Naisah",
    "person_id": "naisah"
   },
   {
    "area_id": "lt2",
    "name_raw": "Iska",
    "person_id": "iska"
   },
   {
    "area_id": "lt2",
    "name_raw": "Inez",
    "person_id": "inez"
   },
   {
    "area_id": "lt2",
    "name_raw": "Dikri",
    "person_id": "dikri"
   },
   {
    "area_id": "lt2",
    "name_raw": "Hera",
    "person_id": "hera"
   },
   {
    "area_id": "lt1",
    "name_raw": "Deviyanti",
    "person_id": "deviyanti"
   },
   {
    "area_id": "lt1",
    "name_raw": "Heri",
    "person_id": "heri"
   },
   {
    "area_id": "lt1",
    "name_raw": "Rangga",
    "person_id": "rangga"
   },
   {
    "area_id": "lt1",
    "name_raw": "Nenti",
    "person_id": "nenti"
   },
   {
    "area_id": "lt1",
    "name_raw": "Mariam",
    "person_id": "mariam"
   },
   {
    "area_id": "lk",
    "name_raw": "Hermawati",
    "person_id": "hermawati"
   },
   {
    "area_id": "lk",
    "name_raw": "Agus",
    "person_id": "agus"
   },
   {
    "area_id": "lk",
    "name_raw": "Revaldi",
    "person_id": "revaldi"
   },
   {
    "area_id": "garbage",
    "name_raw": "muhamad Abdullah",
    "person_id": "muhamad_abdullah"
   },
   {
    "area_id": "gondola",
    "name_raw": "afif",
    "person_id": "afif"
   },
   {
    "area_id": "gondola",
    "name_raw": "riyan",
    "person_id": "riyan"
   },
   {
    "area_id": "gondola",
    "name_raw": "Sahrul",
    "person_id": "sahrul"
   }
  ],
  "total_mp": 37,
  "off_day": 0,
  "sakit": 0,
  "alfa": 0,
  "izin": 0
 },
 {
  "record_id": "lu_0_3",
  "site_id": "lwas",
  "source_message_id": "msg_0_1380",
  "sent_at": "2026-09-10T23:00:00+07:00",
  "sender_raw": "Amartha",
  "sender_person_id": null,
  "confidence": 0.9,
  "shift": 3,
  "date": "2026-09-10",
  "entries": [
   {
    "area_id": "external",
    "name_raw": "Ade",
    "person_id": "ade"
   },
   {
    "area_id": "external",
    "name_raw": "Renno",
    "person_id": "renno"
   },
   {
    "area_id": "external",
    "name_raw": "Nando",
    "person_id": "nando"
   },
   {
    "area_id": "external",
    "name_raw": "Sandi",
    "person_id": "sandi"
   },
   {
    "area_id": "external",
    "name_raw": "Okta",
    "person_id": "okta"
   },
   {
    "area_id": "external",
    "name_raw": "Marhadi",
    "person_id": "marhadi"
   },
   {
    "area_id": "gf",
    "name_raw": "Ani",
    "person_id": "ani"
   },
   {
    "area_id": "gf",
    "name_raw": "Deviana",
    "person_id": "deviana"
   },
   {
    "area_id": "gf",
    "name_raw": "Tiara",
    "person_id": "tiara"
   },
   {
    "area_id": "gf",
    "name_raw": "Junaesi",
    "person_id": "junaesi"
   },
   {
    "area_id": "gf",
    "name_raw": "Febby",
    "person_id": "febby"
   },
   {
    "area_id": "gf",
    "name_raw": "Muhamad hafiz",
    "person_id": "muhamad_hafiz"
   },
   {
    "area_id": "gf",
    "name_raw": "Warti",
    "person_id": "warti"
   },
   {
    "area_id": "gf",
    "name_raw": "Septian",
    "person_id": "septian"
   },
   {
    "area_id": "ug",
    "name_raw": "Mardiah",
    "person_id": "mardiah"
   },
   {
    "area_id": "ug",
    "name_raw": "Damme",
    "person_id": "damme"
   },
   {
    "area_id": "ug",
    "name_raw": "Farhan",
    "person_id": "farhan"
   },
   {
    "area_id": "ug",
    "name_raw": "Sahroni",
    "person_id": "sahroni"
   },
   {
    "area_id": "ug",
    "name_raw": "Nurul",
    "person_id": "nurul"
   },
   {
    "area_id": "lt2",
    "name_raw": "Aryo",
    "person_id": "aryo"
   },
   {
    "area_id": "lt2",
    "name_raw": "Naisah",
    "person_id": "naisah"
   },
   {
    "area_id": "lt2",
    "name_raw": "Iska",
    "person_id": "iska"
   },
   {
    "area_id": "lt2",
    "name_raw": "Inez",
    "person_id": "inez"
   },
   {
    "area_id": "lt2",
    "name_raw": "Dikri",
    "person_id": "dikri"
   },
   {
    "area_id": "lt2",
    "name_raw": "Hera",
    "person_id": "hera"
   },
   {
    "area_id": "lt1",
    "name_raw": "Deviyanti",
    "person_id": "deviyanti"
   },
   {
    "area_id": "lt1",
    "name_raw": "Heri",
    "person_id": "heri"
   },
   {
    "area_id": "lt1",
    "name_raw": "Rangga",
    "person_id": "rangga"
   },
   {
    "area_id": "lt1",
    "name_raw": "Nenti",
    "person_id": "nenti"
   },
   {
    "area_id": "lt1",
    "name_raw": "Mariam",
    "person_id": "mariam"
   },
   {
    "area_id": "lk",
    "name_raw": "Hermawati",
    "person_id": "hermawati"
   },
   {
    "area_id": "lk",
    "name_raw": "Agus",
    "person_id": "agus"
   },
   {